{
  "$schema": "http://json-schema.org/draft-04/schema#",
  "type": "object",
  "title": "Submission",
  "description": "Represents a single interlibrary loan submission",
  "properties": {
    "id": {
      "description": "Unique ID (generated UUID) of the submission",
      "type": "string",
      "$ref": "../../../raml-util/schemas/uuid.schema"
    },
    "userId": {
      "description": "ID of the patron the submission was made by",
      "type": "string",
      "$ref": "../../../raml-util/schemas/uuid.schema"
    },
    "submissionLocation": {
      "description": "The location associated with the submission",
      "type": "string",
      "$ref": "../../../raml-util/schemas/uuid.schema"
    },
    "statusId": {
      "description": "Status of the submission",
      "type": "string",
      "$ref": "../../../raml-util/schemas/uuid.schema"
    },
    "submissionDate": {
      "description": "Date time when the submission was placed",
      "type": "string"
    },
    "requestCount": {
      "description": "A count of the number of requests associated with this submission",
      "type": "string"
    },
    "submissionMetadata": {
      "description": "The ISO18626 JSON metadata used to create the submission",
      "type":  "object",
      "$ref": "submission-metadata.schema"
    },
    "metadata": {
      "type": "object",
      "$ref": "../../../raml-util/schemas/metadata.schema",
      "readonly": true
    }
  },
  "additionalProperties": false,
  "required": [
    "userId",
    "submissionLocation",
    "submissionMetadata"
  ]
}
